,company_name,date_posted,rating,review_title,job_position,job_location,pro_review,con_review
0,Honeywell,,3.0,We get things done. We only get things done.,Engineer,Singapore,"- Good learning opportunity. Exposure to projects of different natures. - Supportive first-line managers. The managers work with the engineers to get things done. The managers are in general very capable, and are armed with the necessary skills and knowledge. - Supportive colleagues. There's a good culture of colleagues helping each other. Most of the time, initiatives were taken to reach out to colleagues in trouble. - Plenty of capable and dedicated engineers. - Pay is above the market rate (but for a reason...)","- We were always in a rush to get things out. In a way, the short time span for products/fixes to be released to the market is good for the business, but it's not healthy from the engineering standpoint. We were not given enough time to research extensively and think things through. - Workload could be heavy, to the point that personal time was sacrificed. - There was also an unbalanced allocation of workload. Capable engineers were loaded more heavily. - The engineers were working on all sorts of different projects, as long as they were related to their fields. Specialisation was not emphasised, and this might result in they becoming 'generalists' rather than 'specialists'. This is limiting the engineers' growth and the quality of their work."
0,Honeywell,,3.0,X,Quantity Surveyor,Singapore,Interesting projects across the region,Poor management with repetitive task
0,Honeywell,,2.0,Highest Paid CEO and Stellar Earnings at the expense of Employees,Engineer,Singapore,- A good place to acquire Aerospace product knowledge for fresh graduates - Emphasis on Lean and Six Sigma has been effective in making the site produce more with less.,- Repeatedly impose pay freeze and furloughs to make the earnings look good despite the company not making any losses. Rank and file employees feel the pinch with pay cuts while the senior management in Phoenix and Morristown enjoy the fruits of higher value of their stock options. Rewarding senior management not for adding value but for a zero-sum game where the company wins and the employee loses - Extremely short sighted and can’t see beyond meeting the sales and shipment target of the month. No willingness to invest in new machines because they depreciate fast and is a drag on earnings. The plant is forced to squeeze whatever juice remaining of the old equipments which are less efficient - Paltry employee benefits. All benefits removed due to cost reductions were not reinstated when the good times return - No career planning for rank and file employees. Almost zero chance of organic promotion. - Lean and Six Sigma focus means extra work for employees without headcount increase
0,Honeywell,,3.0,Pleasant,Solutions Architect,"Bukit Batok New Town,",To contribute in supply chain workflow solutions. Bring innovations in inbound to outbound workflow processes. Increase accuracy and productivity in operations. At least 50% cost savings in labour.,"Need to manage reporting managers and external partners and expected to fill all gaps. Lacks the opportunity to manage lateral partners as the reporting manager is too micro managing and wants detail level of work in progress. Too many team meeting i.e. In one week, meet at least 2-3 times for work progress update. Repetitive timesheet broken down into must do list, need to do list and nice to do list. Absolute redundant activity as all these tasks listed will be tracked as to do, like it or not. Absolute indicator again of micro management by the reporting manager."
0,Honeywell,,5.0,Engineer,Engineer,Singapore,"Leading company with beautiful environment, very good benefit, work and life balanced with sound learning opportunity, nice colleagues with precious memory.","Complex international economic environment brings winter to High-tech industry and effects the company, however, the leading position of the company offers confidence to walk through the difficult."
0,Honeywell,,5.0,Good Company to work and learn,Advanced Applications Engineer,Singapore,Employee Friendly and supportive collogue,Not much. some more working hours
0,Honeywell,,1.0,Intermec,Engineer,Singapore,1) Good colleagues. 2) Above average pay. 3) suitable for freshgrad.,"1) No work life balance. Rushing work to chase schedule all the time. Work is first priority 2) Micro management by superior, stressful working environment. 3) I don't see Honeywell value being demonstrated in this entity of Honeywell."
0,Honeywell,,3.0,Could be better,QA Technician,Singapore,Comfortable workplace and good opportunity to learn new skill,"High pressure and very fast paced, management not so supportive"
0,Honeywell,,4.0,Honeywell,Project Engineer,Singapore,"good culture, minimal management, freedom","limited growth, Management seems to hire rather than promote"
0,Honeywell,,3.0,Work,Engineer,Singapore,Good place to work and develop,Too many people and levels
0,Honeywell,,4.0,No comment,Senior Mechanical Engineer,Singapore,Well run company and profitable,Run with very lean benefits
0,Honeywell,,3.0,Engineer,Senior Engineer,Singapore,Annual pay package above average.,No direction given by the leadership
0,Honeywell,,3.0,Engineer,Engineer,Singapore,Learning the new process and product,Low pay and Low bonus
0,Marvell Technology,,5.0,Great place to work,Senior Staff Engineer,Singapore,Great place to work .,Almost no concern about company.
0,Marvell Technology,,5.0,"Great place to work, many opportunities to grow",Senior Staff Engineer,Singapore,"Interview process was smooth and all done online due to covid restrictions. Onboarding process was very well executed. This is a global company, so, expect global working hours to support multi-region customers and team mates. CEO and leaders emphasize a lot on employee wellness. Take care of employees, and employees will take care of Customers and company's interest. Very strategic acquisition in the past few years to position company as a strong provider for 5G, networking infrastructure company. Company is forward-thinking by embracing working from home and hybrid working model. This is I think the best way forward for productivity and also work life balance. There are many times where I'm very productive when working from home as distractions are minimal or non-existence. Singapore office is very well designed to facilitate and accommodate hybrid working model. Money well spent!","With many recent company acquisitions, there are a lot of fragments that have to be integrated in the coming years. This is normal for any acquisition but more efforts and programs needed to purposely do it. Even though hybrid working model has been going on for few years, people are still not paying much attention to ensure they use very good microphone for zoom calls. More team events need to be organized to get the employees gel together particularly with the recent company acquistions"
0,Marvell Technology,,3.0,"Company is good, some managers are just love to micromanage",Staff Engineer,Singapore,"Good company, salary wise good, opportunity to contribute","Micro managers, 8-12 hours meeting weekly, so much talk, people have less time to work than giving work updates. Slow improvements within team, very rigid mindset and people love to customize things without following any standard.. some people love to work on weekends.. even attend meetings from vacation.."
0,Marvell Technology,,5.0,Good work life balance,Product Engineer,Singapore,"- Pretty good work life balance, if you value your lifestyle. Marvell is the place for you.",- The salary is not competitive for same sector like Micron and AMD
0,Marvell Technology,,3.0,Good company for late or mid career,Principal Engineer,Singapore,Pay is good among companies in Semicon industry.,"Disorganized, frequent re-org and layoff. This is not a good place to start your career with."
0,Marvell Technology,,3.0,Staff Product and ATE Test Engineer,Staff Test Engineer,Singapore,"Very good learning and you get to be involved in all stages of a project from loadboard design, pattern conversion, and then post silicon activities.","need to travel to OSATs all the time for any engineering validation. less no.of time-off per year. In top of that, we need to take compulsory one week off during Christmas holidays and our accumulated time-off will be used for this."
0,Marvell Technology,,2.0,Good in compensation,Staff Engineer,Singapore,Package and other compensation is good,Management is poor Not all team few team
0,Marvell Technology,,5.0,Having good prospect at the current market,Senior Staff Engineer,Singapore,Good strategy and vision Trying to build engineering excellence culture Project schedule is planned with engineering inputs,"People are afraid to make mistake, this might not helps in creating innovative culture Inter-department relationship sometimes is tense"
0,Marvell Technology,,3.0,Great place to work at,Engineer,Singapore,Good colleague relationship. Good place to work at.,Quite slow in pace and people in retirement mode.
0,Marvell Technology,,3.0,Decent place,Staff Software Engineer,Singapore,Lots of learning. Will be working on cutting edge stuffs,Long hours of working. Stressful
0,Marvell Technology,,4.0,It's a good company to work for,Senior Staff Product Engineer,Singapore,Good environment to work for,System improvement for better company scalability
0,Marvell Technology,,5.0,------,Engineer,Singapore,"Good environment, good benefits, friendly enviroment",It doesn't provide Over time pay
0,Marvell Technology,,3.0,Not recommended for achievers,Engineer,Singapore,A lot of office politics,"flexible work arrangement, can wfh"
0,Marvell Technology,,4.0,Nice environment,Applications Engineer,Singapore,Place to learn lot of skills,Closed down some units there
0,Marvell Technology,,3.0,Engineer,Engineer,Singapore,Can Balance work and life,Promotion and benefits not competitive
0,Marvell Technology,,3.0,Engineer,Engineer,Singapore,Working environment is very good,increment is too less compare with outside
0,Marvell Technology,,1.0,Product Engineer,Product Engineer,Singapore,"RSU, learn how to proper email","Chaos, poor management, no proper system, no training to improve the skill sets of employees. Very low appreciation of employees and micromanaging. Very stressful working environment. Definitely no work life balance especially for junior engineers."
0,Certis,,5.0,Best place to work and to grow,Cloud Solution Architect,Singapore,In Certis you matter. They have genuine care for employees. They are very passionate about making things right for the benefit of everyone. They are unstoppable and keep evolving. They have a knack for making things better. They have a very huge room for growth if you want to flex your personal brand. The leadership is very supportive of your ideas and your efforts will surely be rewarded.,You can’t get enough of the works because they keep innovating.
0,Certis,,3.0,"Okay work colleagues, heavy work load",Senior Project Engineer,Singapore,"There is no micro-management here, and you have the flexibility to arrange your time and work.","Some team mates tend not to pull their weight. A single person may be involved in multiple projects, and required to deliver. This can be quite overwhelming at times."
0,Certis,,4.0,Good hybrid work arrangement,Data Engineer,Singapore,Only going to office once a week Many events to attend (optional),Pay little lower than average but to be expected of non-tech companies. Difficult to implement change
0,Certis,,4.0,Great place to learn,Software Engineer,Singapore,- A lot of opportunities to learn - Many projects to dip your toes in - Helpful colleagues,- If you're too good you'll feel stagnant - Too much project for 1 person - Timelines are a bit ridiculous
0,Certis,,4.0,Great but not too great,Senior Engineer,Singapore,A place where you can learn alot.,Very old processes. Still using paper filling system to document things.
0,Certis,,5.0,Great company,Engineer,Singapore,"great, fair management and lots of opportunities","long working hours, low pay"
0,Certis,,4.0,Good Company,Operations Solution Architect,"Bedok New Town,",Good working environment with sincere colleagues who want to get things done. Flexible working arrangements and decent benefits.,"Low basic salary, No Flexi benefits"
0,Certis,,3.0,still okay for work and life balance,Senior Software Engineer,Singapore,still okay for work and life thing. u get to practise the architecture stuff.,overall salary is a bit not so good.
0,Certis,,1.0,Worst Company to Work For Ever,Dormitory Inspector,Singapore,Nothing good about this company. Never join them.,"This company will do whatever it takes to deduct your salary. Imagine you clock out late, not being late for work, not being anything, they deduct your pay. The company asks you to apply leave on your scheduled off day. The company changes their employment terms again and again within a year. The company makes you work on your scheduled off day because they know how to play with the working hours system. They make you work extra day without any money. But if you have family commitment and can't make it, they deduct your salary. company with very poor HR practices."
0,Certis,,3.0,Ok,Project Engineer,Singapore,Work as per normal everyday,Go to work everyday except Sunday
0,Certis,,3.0,Working at certis,Engineer,Singapore,Nice colleagues and working environment,Challenging and long working hours
0,Certis,,3.0,"Good culture, poor management",Engineer,Singapore,"Good working culture, strong bonding among colleagues",Poor management and distribution of work.
0,Certis,,4.0,Ministry of manpower Inspector & Driver,Inspector,Singapore,"Challenging , peacekeeping , tactful , reinforcements, Social distancing .",Always Have last minutes changes
0,Certis,,4.0,Manpower Solution Architect,Operations Solution Architect Senior Manager,Singapore,"Good work-life balance, company embraces technology and digitization",Low base salary with higher year end performance bonus
0,Certis,,3.0,Good learning,Engineer,Singapore,"Good learning ex , nice company,","fast pace , Many process"
0,Certis,,1.0,Low remuneration package,Senior Assistant Engineer,"Paya Lebar,",Nice colleagues in my department.,Too much overtime and weekend assignments. Yearly increment not more than 3%. No career progression.
0,VMware,,5.0,"Best, co ever",Software Engineer,Singapore,"All, everything good will recommend","None, can't think of any"
0,VMware,,4.0,Great Company to work at,Client Solutions Executive,Singapore,Team collabrations and support from other team members is excellent. Even the management provide support in any way that they could to ensure the suceess of the employee.,Fast pace environment and many new technology to keep up with.
0,VMware,,5.0,Amazing place to work,Solution Architect,Singapore,Amazing place to work. Fantastic place to build career,No downsides to be honest. Work hard
0,VMware,,4.0,Solution Architect,Solution Architect,Singapore,"Good Culture, Nice facilities and flexible work from home policy",Many overlay functions. Uncertainty due to Broadcom acquisition.
0,VMware,,4.0,Will suit those looking to blend engineering and customer/people skills (Tanzu Labs formerly Pivotal),Software Engineer,Singapore,"- no overtime - able to experience different domains and organizations, yet not having to be chained to their baggage (if any) since you rotate to a new project every couple of months",- technical complexity and learning opportunities may not be high (depends on region)
0,VMware,,5.0,How is the company?,Senior Solutions Architect,Singapore,VMware is a great company. I had great fun and learn a lot during my time with them. Good company culture.,They tried to reduce the size of the specialist team expecting the core team to be do the job that but failed. They increase back the size a few years later but just did it again.
0,VMware,,5.0,Great Organization to work,Senior Solutions Architect,Singapore,- Healthy work environment - Leadership team communicates the roadmap clearly - Great benefits for personal/professional development,- Health insurance can be improved
0,Johnson Controls,,5.0,Good environment,Engineer,"Jurong East New Town,",Lots of things to learn.,Sometimes may be overloaded with work.
0,Johnson Controls,,3.0,Soso,Engineer,Singapore,Good pay and benefit is acceptable,Too much to work with .
0,Johnson Controls,,4.0,Good Work Culture,Project Engineer,Singapore,Easy going colleague and bosses,Difficult standard procedure of work.
0,Johnson Controls,,4.0,Application manager,Senior Applications Engineer,"Tampines New Town,",Able to learn many things,"On job training, not easy for rookie"
0,Johnson Controls,,1.0,Messy,Senior Project Engineer,Singapore,Salary nothing else is good,Poor management bad culture no trust
0,Johnson Controls,,1.0,First class company with third class processes,Engineer,Singapore,The company benefits are good.,"Poor management. No on the job training. No process , no standardization, no sop. Still living in excel world. High turnover rate. No work life balance, although you will keep receiving a lot of emails saying how the company valuated work life balance. It's a joke"
0,Johnson Controls,,4.0,Good culture,Project Engineer,Singapore,Good working culture in the team,Salary and remuneration is not so competitive
0,Johnson Controls,,4.0,Great work culture,Test Engineer,Singapore,Efficient communication and teamwork Friendly work culture,Long working hours Saturday need to work sometimes
0,Johnson Controls,,2.0,Chaotic Management,Project Engineer,Singapore,Welfare system is in placed and pretty comprehensive,Chaotic Management on year 2019 at Fire Department
0,Johnson Controls,,2.0,Good place to start your career,Project Engineer,Singapore,"Friendly colleagues, High Workload to keep you occupied","Incentives & Bonuses, made to do tasks that are not supposed to fall under your scope"
0,Johnson Controls,,4.0,"Expose to various knowledge on building management system, chilled water plant equipment etc",Engineer,Singapore,Good work-life balance. Good career growth.,High Frequency of management movement
0,Johnson Controls,,4.0,career prospect,Senior Software Engineer,"Jurong West New Town,",Very friendly and approachable colleagues,not much career opportunities open for people
0,Johnson Controls,,4.0,great,Applications Engineer,Singapore,Great team to work with,Too many Changes in leadership
0,Hitachi,,5.0,Work culture,Engineering Manager,Singapore,"Freedom to perform work, but evaluation based on result.","I can see engineers are underpaid, even though work long hours."
0,Hitachi,,3.0,Good people,Tendering Engineer,Singapore,Good management and human within the company,Poor incentives and structure. Strict reporting time etc.
0,Hitachi,,3.0,Normal careers progress,Engineering,Singapore,Corporate experience in multi regional support,Career progress is slow and decision making is slow
0,Hitachi,,4.0,"Stagnant, but good for retirement",R&D Mechanical Engineer,"Jurong East New Town,",Less stress of working environment,Career progression is slow and low salary
0,Hitachi,,5.0,Working culture,Engineer,"Tampines New Town,",everyone is friendly here and work as a team,Require good time management to handle your job
0,Hitachi,,3.0,Construction work,Engineer,Singapore,It as a work life balance culture,It provide minimum annual leave starting at 11days.
0,Hitachi,,3.0,Nil,Engineering Specialist,"Paya Lebar,",Nothing much actually but quite tired,Long working hours and its boring.
0,Hitachi,,3.0,Salary matches your job scope,Engineer,"Jurong East New Town,","Low stress, people are friendly.","Low Compensation, promotion is slow."
0,Hitachi,,2.0,Nice place to work,Lead Engineer,Singapore,Most members are nice to get along. Willing to work together,1) Pay does not align to market rate. 2) Job grade structure and job progression path is not well define. 3) Location is at Gul or Tuas (Far west in Sgp) 4) Conventional thinking. Low willingness to accept new idea
0,Hitachi,,3.0,Company Review,Engineer,Singapore,Work life balance for non projects involved.,Starting with 11 days of annual leaves.
0,Hitachi,,4.0,Good Prospect,Engineer,"Changi Village,",Good and helpful colleagues at work,Can not think of any
0,Hitachi,,4.0,Average,Engineer Executive,"Jurong East New Town,",Great learning for fresh graduate,Salary too low and less exposure
0,Hitachi,,4.0,Good,Project Engineer,Singapore,Good company to work for.,No major cons in particular.
0,Hitachi,,5.0,Good,Engineer,"Bedok New Town,",Good working experience in the team,Long working hours very busy
0,Hitachi,,3.0,good company,Engineer,Singapore,good company to work with,too large of a company
0,Hitachi,,5.0,This place is recommended,Assistant Engineer,"Jurong West New Town,",Great work environment and good workload,"Lower in pay, needs better progression prospect"
0,Hitachi,,3.0,Autocratic Management Style,Assistant Manager Inspection,Singapore,1 Easy for fresh graduates as good learning ground. 2 Actions are in line with the autocratic leader.,1 End up in less innovation and initiatives. 2 Only one strong leader can be exist.
0,Hitachi,,3.0,Engineer,Engineer,Singapore,Great benefit with alot of business trip opportunity,Typical of large corporation with a certain level of bureaucracy. Alot of senior staff hence innovation is limited
0,Hitachi,,3.0,Engineer,Engineer,Singapore,Work Life balance culture to consider,Little leave benefit to reconsider
0,Hitachi,,4.0,Company review,Engineer,Singapore,Have Flexible hours working time,"Work Long hours occasionally, depend on customer request"
0,Hitachi,,3.0,big corporation problem,Engineer,Singapore,big corporation well known worldwide,no cooperation between hitachi's companies
0,Hitachi,,4.0,Good workplace environment,Engineer,Singapore,"Team, Managers are very friendly",Little long term career projection
0,Hitachi,,3.0,Not applicable,Engineer,Singapore,Nice and supportive fellow colleagues,Micro management from direct superior
0,Hitachi,,2.0,Engineering company,Project Engineer,"Changi Village,",International colleague understand different culture,Disorganized workforce messy system and processes
0,Prudential Assurance Singapore,,5.0,Excellent,Senior Software Engineer,Singapore,The company is good experience,IT was a good experience
0,Prudential Assurance Singapore,,3.0,Good Benefits,Software Developer,Singapore,Able to switch roles easily.,Not easy to get promotion.
0,Prudential Assurance Singapore,,3.0,Slow and relax,Software Engineer,Singapore,Balance between work and life if you know how to deal properly. Flexible working arrangement.,Everything is quite slow. Salary hike is not high.
0,Prudential Assurance Singapore,,4.0,Great working environment,QA Specialist,Singapore,Flexible working arrangement Great working culture,Heavy workload Expected to OT to deliver
0,Prudential Assurance Singapore,,4.0,Review,Data Engineer,Singapore,Good tech stack for career advancement,Still good and no cons at the moment
0,Prudential Assurance Singapore,,1.0,"Toxic Politics, IT Division run by Powerpoint Tales Sellers",Senior Site Reliability Engineer,Singapore,"Offices, Perks, Engineer Mates that suffer same curses as you.","Toxic Politics IT Division run by Marketing people with no clue at all of engineering Management sells stories of powerpoints, with no fundament or truth Best engineers leaves quickly"
0,Prudential Assurance Singapore,,3.0,Job experience,Quality Assurance Analyst,Marina East,Colleagues are supportive and team spirit is strong.,"Stress from human factors, conflicting interests."
0,Prudential Assurance Singapore,,3.0,"High pay, but risk your health",Senior Engineer,Singapore,the pros is good pay,the cons is no work life balance
0,Prudential Assurance Singapore,,4.0,Cloud engineer,Cloud Engineer,Singapore,chance to learn new technologies,"No work life balance, long working hours ."
0,Carrier,,5.0,Nothing,Engineer,Singapore,"Good culture, good environment for fresh","High pay, high salary, income"
0,Carrier,,4.0,Worklife balance,Engineer,Singapore,Good for work life balance,Slow promotion as older staff will be promoted first
0,Carrier,,4.0,Good benefits,Engineer,Singapore,Good benefits n bonus payout,Fast pace and high workload
0,Carrier,,1.0,"MNC in name, SME in nature",Engineer,Singapore,Nothing that I can think of,"Newcomers left to swim or drown Zero work-life balance, you are expected to be available 24/7"
0,Carrier,,1.0,Stressful,QA Engineer,Singapore,"Nothing, working environment also unfriendly","Heavy workload, many KPIs, micromanagement"
0,Carrier,,4.0,great,Staff Engineer,Singapore,good teamwork and great enviroment,low learning opportunities through out the years
0,Carrier,,3.0,Carrier,Engineer,Singapore,Slow pace and friendly colleagues,"Slow pace, hard to progress"
0,Carrier,,1.0,Toxic Environment and lacking true MNC culture.,Draftsman,Singapore,- Free Medical and Dental - Parking - Opportunity to Learn,"- Too many Managers/Supervisors with zero EQ. - Shouting at colleagues is condoned here especially in drafting team. - There is no professionalism here as supervisors are quick to berate subordinates, no matter how minor the mistake may be. Its also common to receive emails entirely written in capital letters. These points were brought up to the respective heads but it only fell on deaf ears. Talk about harassment."
