,company_name,date_posted,rating,review_title,job_position,job_location,pro_review,con_review
0,NCS,,5.0,Good Company for learning different technologies,Senior Software Engineer,Singapore,"You can learn different technologies if you are interested Since NCS has most of the Singapore government IT projects, we have a good chance to up skills up to the market.","According to my view, no Cons about the company."
0,NCS,,3.0,"Good for stability, bad for growth",Software Engineer,Singapore,fresh grads get a bootcamp to ease them into company tech stack,"project you get assigned to may not be using that tech stack, maintenance teams may be using older tech. hard to progress if assigned to maintenance teams due to performance metrics, so try to stay on dev teams"
0,NCS,,2.0,bad proj,Software Engineers,"Ang Mo Kio New Town,",Mainly the benefits from the company.. Good leaves Take certification Career development,"Bad project, practices, management Colleagues all busy, new people cant get mentored properly. Usually OT"
0,NCS,,4.0,Good place to start,Software Engineer,"Novena,",Focus on software development as compare to some companies with misc stuff to handle like organising events.,Fresh graduate will usually earn more than current employees even with years of experience.
0,NCS,,4.0,good,Software Engineer,Singapore River,"work life balance, no ot","under payed, bonus very low"
0,NCS,,3.0,Bad increment,Software Engineer,Singapore,Work on a lot of systems,Bad increment of 100+ dollars
0,NCS,,2.0,Toxic environment,Senior Software Engineer,Singapore,Good wlb depend but depend on project stable job,empty promise from reporting manager like to show favouritism incompetent project manager not hiring the right person for the job and simply throw person on the ground due to clearance low compensation
0,NCS,,3.0,work life in ncs,Software Engineer(Internship),Singapore,work life balance and not far,"low pay, its really low"
0,NCS,,3.0,Good training ground,Software Engineer,Singapore,Courses are free. Barrier of entry is low. Always given a chance to try.,Lower than average pay Hr is non-existent Company performance impacted by parent company
0,NCS,,3.0,Good as a first job,Software Engineer,"Ang Mo Kio New Town,","Nucleus program, work load depends on client","Low progression at start, raise is fairly low"
0,NCS,,3.0,Jus for fresh talent,Cloud Associate,Singapore,No experience Some projects less work so can self learn,Low salary Late promotion No aws 1 month bonus
0,NCS,,3.0,Proj lead consultant lacks leadership,Software Engineer,Singapore,"Nice building, canteen with affordable drinks, gym","Lead consultant who is also delegated as the PM, lacks leadership. Conducted mass performance appraisal over MS Teams with >15 software engineers."
0,NCS,,4.0,Acceptable pay,Senior Software Engineer,"Ang Mo Kio New Town,","Depend on team, and boss",Had to get promotion and increment
0,NCS,,2.0,It's the luck of the draw,Software Engineer,Singapore,Decent salary. Exposure into the scale and reach of this company.,Summary: Inconsistency in the workplace. Hard to recommend. The decent salary quickly turns sour as OT starts creeping in. There is no standardization between teams in how software engineering and the entire lifecycle is approached. This can easily imply how this affects project management and development environment. Lack of sympathy and poor attitude towards health is also present.
0,NCS,,2.0,Work life balance,Software Engineer,"Ang Mo Kio New Town,",Work life balance Free gym,Legacy of the legacy system
0,NCS,,3.0,Ok,Data Engineer,Singapore,Local env and good benefit,Company is ok but not interesting projects
0,NCS,,3.0,Increment,Software Engineer,Singapore,Some department can provide decent opportunities.,Increment and bonus is very bad last year
0,NCS,,4.0,Good place to learn but can be overloaded,Cloud Engineer,"Ang Mo Kio New Town,",Many projects to choose from and colleagues are generally nice. No micro-managing. Good for ppl who likes to try different roles and there are opportunities to take up more responsibilities.,Too many projects and poor match of engineer skillsets. Expected to handle 3 projects or more depending on the management you are under. Limited work life balance/harmony.
0,NCS,,4.0,Workload can be heavy but stablr,Lead Engineer,Singapore,"Stable company, good office, legit mnc","High workload, punishing deadlines, mega deals"
0,NCS,,5.0,Salary,Software Engineer,Singapore,Stable Job and flexible management,Slow progression and no WFH
0,NCS,,3.0,Stable Job but slow progression,Software Engineer,Singapore,"Job is pretty stable, working hours are dependent on assigned project, it's possible to have some form of work life balance","Progression is slow, work is project based so many things depend on what project you're assigned to. Projects on fire or with bad management can be tough to work in, you will learn a lot and might have minimal guidance and cover many tasks outside of being a software engineer, but it is a learning experience regardless."
0,NCS,,5.0,Good Company for learning different technologies,Senior Software Engineer,Singapore,"You can learn different technologies if you are interested Since NCS has most of the Singapore government IT projects, we have a good chance to up skills up to the market.","According to my view, no Cons about the company."
0,NCS,,4.0,Good to learn things,Software Engineer,Singapore,- friendly colleagues - competitive pay - multiple projects to learn coding skills,- might ot sometime - bonus can be better
0,NCS,,3.0,Average,Solution Architect,Singapore,Flexible time Good colleagues depending on team,Shorthanded on almost projects Some Difficult internal stakeholders
0,NCS,,3.0,NCS,Software Engineer,Singapore,-Is a good company to learn -Colleagues are very helpful and have learnt a lot from my seniors -Free master course,"-Salary does not match the amount of work/projects being assigned. -You may have a title of software engineer, but performing 3 different roles. (Business Analyst, Developer, Tester) -Increment and bonus are little. -Whether you can attend the master course depends on your workload or PM."
0,NCS,,3.0,Decent depending on project,Software Engineer,Singapore,"Decent benefits, team members, and food provided.","Less communication, no team bonding, and awkward vibes overall."
0,NCS,,3.0,Base salary,Software Engineer,Singapore,-Good work-life balance if you are in the right project -Flexible working arrangement,-Low pay -Slow progression -Almost no bonus
0,NCS,,3.0,Average company,Devops Engineer,Singapore,"everything that you ever imagine is average here, from benefits to lunch options to working with average people. wfh for 1/2 days depending on team weekly.","work culture is not great at all, expect to OT a lot. a very typical singaporean company that tries to be a modern tech company but fails very badly in doing so. there is mistrust between employees across the hierarchy. overall, there's a sense of micromanagement and generally do not feel great working there. good to check out forums on NCS before applying, most of what is written there and on here is mostly true."
0,NCS,,3.0,ok,Software Engineer,Singapore,decent pay and good colleagues,very little to no worklife balance
0,NCS,,2.0,Decent first job,Software Engineer,Singapore,"Decent starting pay, decent working environment",Career growth severly limited and entirely based on project you are assigned to. Low salary increment(1%) at the time of writing
0,NCS,,3.0,Good place for learning and leaving,Software Engineer,Singapore,Good colleagues Exposure to production work early on If you can learn fast on your own it is good for you,Bad pay and unwillingness to pay you fairly
0,NCS,,4.0,Not a place crowed with talented people,Senior Software Engineer,Singapore,Good entry for fresh graduate,Talent density not high could lead to projects not well managed.
0,NCS,,3.0,No career prospect,Software Engineer,Singapore,Worklife balance and better than average benefits,"Low bonus, low pay. Little to no career advancemenr"
0,NCS,,5.0,Had a positive experience working in NCS,Senior Software Engineer,Singapore,I have had a positive onboarding experience with the team and the team was welcoming and helpful.,No negative things until now
0,NCS,,2.0,Performance appraisal lacks proper structure and transparency,Software Engineer,Singapore,Good for newcomers struggling to find a job,"Pay is below market rate Hardwork doesn't amount to anything if you aren't visible or in bosses good shoes Management are not clear on what is happening on the ground and too fixated on meeting timeline rather than delivering a quality product Attrition rate is extremely high due to poor environment, wellfare and culture."
0,NCS,,4.0,Good for career starter,Cloud Executive,"Ang Mo Kio New Town,","Opportunities to learn, broad range of technology, many chances to up-skill.","Lower salary range, project dependent."
0,NCS,,5.0,NCS Pro and Con,Applications Engineer,Singapore,Good place to learn and progress,Not a good environment due to policies
0,NCS,,1.0,LEAVE! Company severely underperformed FY23,Software Developer,Singapore,Easy entry for early graduates.,"1. No trainings 2. Promises on masters (nucleus) is a lie 3. Slavery and OT culture 4. Immediate termination on the spot (i have seen 3-5 colleagues getting fired for the tiniest reasons (got caught taking tea break, etc) 5. Bonus less than 1 month + pay increment less than 2% 6. No salary negotiable upon permanent conversion (HR says sorry must be standardize across regardless of performance.) 7. You have a director that says this kind of stuff ""Do you think I spend my personal money for all these work dinners for nothing? I want the team to gel together and work even harder and smarter than before."" when you chose not to come to their ""voluntary"" team sessions. 8. Lost most their projects and tenders, etc. 9. Extremely secluded area with no valid dining places. Their canteen have effectively 1 STALL only where you can queue up to 40 minutes with 200~ people who WFO queuing."
0,NCS,,3.0,Nice Environment,Software Engineer,Singapore,"Good Work Culture, Work Life Balance",No Career opportunities within organization
0,NCS,,4.0,"Best local company with Global vision , Great culture and learning",Sr. DevOps Software Engineer,Singapore,"Company has good culture and cares about people. People are treated fairly and respected for what they do. NCS has partnership over 100 tech companies which gives you an opportunity to explore free learnings and upskill. Has many different department like Cloud DevOps , App development and it's easy to move between dept. Great potential to grow yourself individually.",Since it's a service based company sometimes you may not be in desired project/technology but you have an option to explore and discuss with your manager.
0,NCS,,2.0,30/70,Cloud Engineer,Singapore,"Free training & certs, work life balance, no stress, assigned to projects you cannot choose","No Increment, low bonus, less technical person, more political"
0,NCS,,4.0,Ok,Senior Engineer,Singapore,"Support employee to growth, team work is okay",Sometime challenge to handle customer.
0,NCS,,2.0,High turnover rate due to poor management and poor pay structure,Software Engineer,Singapore,Good stepping stone for fresh graduates to enter IT industry.,Management have poor foresight and planning. Always waiting for issues to happen instead of fixing them directly. Poor pay structure results in newcomers being paid more than those that stayed loyal to company.
0,NCS,,4.0,It was ok,Software Engineer,Singapore,Supportive and good manager and good bonus,"Depends on team, insurance and benefits can be better"
0,NCS,,4.0,Good Start,Software Developer,"Ang Mo Kio New Town,",Get to do various Courses,was advice not too stay too long as not to get too comfortable
0,NCS,,4.0,Good Insurance,Senior Software Engineer,Singapore,Good Insurance which can cover family member,Depends on project. Might not learn much in some project.
0,NCS,,3.0,Not Many benefits,Software Developer,Singapore,Not many to be honest,Poor management Not many benefits
0,NCS,,4.0,Developer,Software Developer,Singapore,"Great colleagues, supervisor for the department I am in is great to work with.",Project that our dept is working on is in a bad state.
0,NCS,,5.0,Amazing Place to meet minds alike,Software Engineer,Singapore,Friendly Environment Good Bosses Depends on Projects,No 13th Months Bonus as it's added into your pay No AWS packages
0,NCS,,2.0,Company does not fit the employee to the correct role,Software Engineer,Singapore,Various gov project to join,Company does not fit the employee to the correct role
0,NCS,,4.0,Bad upper mgmt,Software Engineer,Singapore,Many projects to choose from,Job is ok but upper management keeps putting pressure to keep the wallets thick
0,NCS,,2.0,"Good starting stone, but should leave after a year or two",Cloud Engineer,Singapore,Flexible working environment Good starting stone,Pay increment isn’t good Not appreciated or valued OT a lot without enough compensation
0,NCS,,2.0,Review,Software Engineer,Singapore,Flexible working options. Nice office,"Political, no increments and promotion"
0,NCS,,5.0,Great Platform for Job seekers,Senior Software Engineer,Singapore,"It offers the following, - the collaborative and inclusive work culture - opportunities for professional growth and - a strong focus on work-life balance.",I don't have any downsides so far.
0,NCS,,5.0,Best organization,Application Engineer,"Ang Mo Kio New Town,",Best practices Fun n work Work life balance,No prob Not applicable Doesn't have any complain
0,NCS,,3.0,Employment,Software Engineer,Singapore,Flexible working hours and locations,Increment and salary is somewhat fix
0,NCS,,3.0,Salary,Software Engineer,Singapore,Slow pace jobs for people who want to chill,Might get a bit too boring
0,NCS,,3.0,Okay,Database Administrator,Singapore,Exposed to a lot of projects.,Poor increment. Small projects but multiple projects.
0,NCS,,4.0,-,Software Engineer,Singapore,"good experience, helpful and talented colleagues",lack of work life balance
0,NCS,,3.0,not recommend,Software Engineer,Singapore,"stable, environment not bad, be able to learn some new techs","ur performance review is based on your race and your age. PMs will make you take all the responsibility if you are junior. No respect in work, PMs do not treat you like men and no bonus."
0,NCS,,3.0,not recommend,Software Engineer,Singapore,"stable, environment not bad, be able to learn some new techs","ur performance review is based on your race and your age. PMs will make you take all the responsibility if you are junior. No respect in work, PMs do not treat you like men and no bonus."
0,NCS,,5.0,-,Software Engineer,Singapore,Ok Good Fine Suitable for Fresh Grad,Low pay increment Unreasonable task
0,NCS,,2.0,Good place to upskill and be exposed to real time programming work,Software Developer,"Ang Mo Kio New Town,",- Full-stack - Exposed to various technologies - Work with different clients on different requirements - Work-life balance - Helpful and supportive team environment (varies),"- Team environment can vary, if you are lucky, you will have a good team lead and manager - Security implications can hindle work (maybe 10 mins work can lead to 1 hour because of all the security restrictions) - Older technologies for some projects - Lower pay despite brand new image in competition - High turn over rate because company values new employees than existing employees."
0,NCS,,4.0,Good Work Culture,Software Engineer,Singapore,Good work environment overall in team.,Not much to mention as per my notice.
0,NCS,,4.0,Good,Software Developer,Singapore,Salary is at market rate,"Long work hours, no work life balance"
0,NCS,,4.0,normal,Software Engineer,Singapore,friendly teammate friendly manager not much ot,"low salary, old tech stacks"
0,NCS,,4.0,Nucleus 2.0,Software Developer,"Bedok New Town,","Joined Nucleus 2.0, training provided, good pay, decent location","Working environment is only decent, not great, working location depends on which project you are posted to"
0,NCS,,2.0,"No work life balance, poor managemen",Seniour Software Engineer,Singapore,"Decent Salary, opportunity to be a perm employee","Too much work pressure, known for bad work culture and management"
0,NCS,,2.0,Good place to get training and upskill,Senior Software Engineer,Singapore,"- Company is supportive on providing training for upskilling like Azure or AWS. But also depends on the project if the manager approves you go training or not. Some managers think your training is irrelevant to the project and might not approve. - Also depends on the project, company is supportive on project transition, but only if your current project manager ok with it. - Career manager is caring.","- Performance evaluation is very ambiguous and unfair. Based on which project you are in and your relationship with your project manager. Some people who perform so so, come late and go home on time can get same or better performance rating than those who need to handle a lot workload, work overtime, and traveling to-and-from client site. - Was in a maintenance project, need to stand by support during the weekends and no there was off-in-lieu, even if issues happen and you have to work during the weekends. The managers think it's your duty. - The managers have no clue what and how the team is actually doing. They are totally layman. Even if got issues they cannot help and solve. All they know is project margin, budget, timeline, what is the issue severity, can issue severity be downgraded so that no need to escalate, what to report to the higher management, meeting and micromanagement. - Some managers want to save project budget, instead of hiring new people, they ask you to work in two projects. They say 20% 80%, but actually you have to work 100% 100%. I mean, seriously, how do you measure works in 20%80%? - Company and projects want to save cost. A lot of time needs to work with offshore team in India. Hard to communicate and collaborate with them especially in government projects, a lot of constraints sharing project knowledge with them."
0,NCS,,4.0,Great work life balance,Software Developer,Singapore,"Slow pace, great work life balance.",Environment to settle and not to progress fast.
0,NCS,,3.0,Great place when you are old,Software Engineer,Singapore,"Balance, friendly team members and leader","Few bonus, tech level cannot keep up with the latest, can't really improve your career."
0,NCS,,4.0,Software Engineer at NCS,Software Engineer,Singapore,Good for starting your career.,Gets stagnant over time and growth is slow.
0,NCS,,4.0,Review,Software Engineer,Singapore,"All government agency work, not bad","pay is little, and really depends on the project assigned."
0,NCS,,4.0,Overall okay but low increment,Software Engineer,Singapore,Progressive career Good starter salary,The increment not really good
0,NCS,,3.0,Na,Software Engineer,Singapore,"Nothing to share , not much advantages compare to other company",Bonus less than 1 month
0,NCS,,5.0,No for now,Staff Software Engineer,Singapore,good working environment and work-life balance.,I have no idea about this one.
0,NCS,,5.0,Good Work Life Balance,DevOps Architect,Singapore,Good work culture Lot of benefits for full time perm staff,Nothing as of now in my current role
0,NCS,,2.0,Bad management,Cloud Engineer,Singapore,Colleagus are Good receive a lot help from senior,Treat experence engineer as fresh engineer for senior workload
0,NCS,,4.0,Good place to start,Software Engineer,Singapore,Stable job Good place to start,No cons at the moment
0,NCS,,3.0,Not bad need more growth,Software Development Engineer In Test (SDET),"Ang Mo Kio New Town,",Get to learn many opportunities,Pay scale could be better
0,NCS,,5.0,Good company,Software Engineer,Singapore,guided with good mentors and knowledgeable project managers even if you have no previous work experience in the field,"If you are not resourceful enough and shy to ask for help, this job is not for you"
0,NCS,,5.0,Best org,Devops Engineer,Singapore,provide onsite opportunity good benifits birthday leave marriage leave marriage and baby birth gift,Onsite compensation need to increase
0,NCS,,4.0,Good starting place for an IT career,Lead Cloud Engineer,Singapore,Exposure to different technologies and environments,Some projects can be rather demanding and too fast paced.
0,NCS,,2.0,About ncs,Software Engineer,Singapore,Good place to learn about soft skill and start your tech journey,You don get to choose the project that you have interest
0,NCS,,3.0,bad reputation and high turnover rate,Software Engineer,Singapore,"As it is a big company, depending on your assigned project, you can have great work life balance. Seniors i was assigned to were very helpful.",Company reputation is widely known to be bad. I have colleagues that have projects in other locations that have terrible work life balance and numerous OT. Turnover rate is high as employees usually leave between 1 year or less.
0,NCS,,3.0,Good company to enter if you are new in industry,IT Infra Engineer,Singapore,Going through a transformation Have a nice newly renovated HQ office High likely no retrenchment,Depends on which project some might be quite tough and no growth Don't expect
0,NCS,,1.0,Stepping stone,Software Engineer,Singapore,Stepping stone for entrance to software Eng job,Work environment sucks and not nice
0,NCS,,4.0,"Work and People are Good, Low Salary",Devops Engineer,Singapore,Manageable work but depends on team Manager does not micro 2 day WFH,Low salary and bonus Have to OT some days 3 days WIO
0,NCS,,3.0,Decent company,Software Engineer,"Ang Mo Kio New Town,",Can't really recall it was a year ago.,Need better planning for new intakes.
0,NCS,,4.0,Work environment,Software Engineer,Singapore,Good Team and supportive environment,Nothing specific to comment about it
0,NCS,,4.0,Overall ok,Technical Lead/Solution Architect,Singapore River,Flexible Good people culture Good benefits Good training opportunities,Too much politics Overly heavy management level
0,NCS,,3.0,Great for freshies. Progressive leadership.,Software Enginner,Singapore,Great place to start work,"Challenging work, yet incredibly fulfilling"
0,NCS,,3.0,poor work life balance,Senior Software Engineer,Singapore,Bonus at the end of year Latest technologies,Poor work life balance Poor project planning
0,NCS,,3.0,Lots of OT,Software Engineer,Singapore,Dress down day every day,"OT almost every day, colleagues not very friendly"
0,NCS,,5.0,Good Company,Senior Cloud Engineer,Singapore,Leave policy is good. Managers are helpful. Resourcefulness and multiple projects.,I see none as of now.
0,NCS,,3.0,Work too rush,Software Engineer,Singapore,You can learn fast in NCS,The project is on fire when you being assigned to that project normally
0,NCS,,3.0,Retirement life,Wintel Engineer,Singapore,Easier life Relax No Challenge,Routine Job No new learning
0,NCS,,4.0,engineer,Cloud Engineer,Singapore,good as a stepping stone many training given,has a bad rep but will take time to improve its rep
0,NCS,,3.0,Both good & bad,Software Engineer,Singapore,Team enviornment is great. Good opportunities for professional growth,Annual increment is quite low
0,NCS,,2.0,Depends,Engineer,"Tampines New Town,",Nothing much to say on this section perhaps from my projects POV,Most of the new hires have 0 knowledge on Tech related stuff.
0,NCS,,3.0,just koay,Software Engineer,Singapore,life balance if project is nice,low increament for salary unlessgot promotion
0,NCS,,4.0,Review,Senior Software Engineer,Singapore,Yearly annual salary wage review Flexi dollars available,"Depends on projects, workplace could be toxic"
0,NCS,,3.0,Fresh graduation friendly,Software Engineer,Singapore,"chance to learn lot thing. if you need to be spoon feed with everything, then you will struggle.",employee that are doing maintenance project will stuck onsite until you request for a change project. Which will join more worse project. slow career growth.
0,NCS,,2.0,Worklife,Senior Cloud Engineer,Singapore,No worklife balance pay is lower than market,good for learning new techs
0,NCS,,2.0,"Good project, bad project management.",Software Engineer,"Ang Mo Kio New Town,","I got to work on a new project that uses up-to-date technologies for the implementation (NodeJS, Java (Spring Boot), AWS, microservices) with good practices (test-driven development, CI/CD pipeline). Basically, if you're new to the industry, you get to gain a lot from it. Although, it depends on the project you're attached to.","Bad project management (i.e. over-promising deliverables, bad planning, incomplete requirements gathering), leading to incomplete/incorrect information for developers to work on, with constant pressure from management to deliver results (due to assigning too much work for each sprint)."
0,NCS,,1.0,Not worth the effort,Software Engineer,Singapore,"Stable environment, for people who like to take instructions and follow a regulated environment.","freedom, stay away from this company because most of their projects are government related, customer has the last say, be it right or wrong. NCS is always a vendor and will not defend thier employees. The salary is below market rate."
0,NCS,,4.0,Not bad,Cloud Engineer,Singapore,Flexible working schedule with MNC level benefits,Lack of growth opportunities m
0,NCS,,4.0,Good place to start out for individuals with no experince,Software Engineer,Singapore,"Depending on your project, you will have sufficient time to learn on the job.",Salary and bonus structure is comparatively lower as compared to other companies.
0,NCS,,5.0,Good,Software EngineerSenior,"Bedok New Town,",Good work and good place,None none none none none
