,company_name,date_posted,rating,review_title,job_position,job_location,pro_review,con_review
0,Accenture,,1.0,good branding. the end.,Business & Integration Architecture Analyst,Singapore,Accenture has good branding in the industry and the starting pay is better than many SMEs.,"- The type of project (& its clients) matter a lot. It can make or break the start of your career with Accenture. - Also subject to the management on the project. If your project's management doesnt understand tech or doesnt know how to run your project, a technical career can suddenly turn into a political one and you become an email and ppt warrior. So under the guise of ""need to do this for project delivery"", you wont get the job scope or career growth you were promised. - Sometimes zero OT benefits when have to rush because management ignores dealing with actual problems"
0,Accenture,,4.0,Application Development Manager,Application Development Manager,Singapore,Nothing to share beside its too people centric,No work-life balance and to people centric
0,Accenture,,5.0,Nice place to work and learn,Software Engineer Lead,Singapore,Accenture is a great place for new joiners to learn and pick up certain business-related skillset.,Projects would be crazy but worthy to dedicate.
0,Accenture,,5.0,Great starting place for fresh grad,Data Engineer,Singapore,"- Opportunity to join multiple project in different industry - If you are lucky and get the right team, the learning opportunities are immense - Great branding for future branching out",- Long work hours - Some team leaders can be nasty and cause high attrition
0,Accenture,,4.0,Software Development Senior Analyst,Software Development Senior Analyst,Singapore,"Good benefits, young and vibrant teams always have a zest for life","lesser work life balance, short timeline to complete tasks. Manager makes a difference to the project. Lucky you if you find a good manager."
0,Accenture,,5.0,Great place to start,Software Engineer,Singapore,You can learn many things here and get to connect with many types of people.,"Not recognized for your efforts, benefits are quite little"
0,Accenture,,3.0,Salaray,Business and Integration Architecture Senior Analyst,Singapore,Provide corporate insurance and platforms to self study for cloud certification,The salary is below average. The bonus is really bad.
0,Accenture,,4.0,Good,Software Engineer,Singapore,Recommended at least can have great career ahead,24/7 working no more Work life Balance
0,Accenture,,3.0,3/5,Senior Software Developer,Singapore,1.) Good Benefits 2.) Pay is ok,1.) I don't like the people in my project but depends on the project.
0,Accenture,,5.0,Great place for internship,Software Developer Intern,Singapore,Hybrid work office Flexible bosses and leadership Fun environment MacOS Dev Environment,"Projects can take up to 3/4 years to complete Have to meet clients expectation, not users."
0,Accenture,,4.0,Best place to work,Senior IOS Developer,Singapore,"Global company, Competitive salary, Well managed work life balance",Some times feels less competitive HR things take little longer than small organization.
0,Accenture,,4.0,Very good,Data Engineer Consultant,Singapore,Good salary benefits and insurance coverage,Nothing much.Sometimes too much work depending on client.
0,Accenture,,4.0,Deliver and deliver,Software Engineering Senior Analyst,Singapore,Learn how to deliver more features within an x amount of time ASAP,No time given to explore for innovation n growth
0,Accenture,,4.0,Accenture,Software Developer,Singapore,- Great exposure - good office location (not project),- work life balance is worst
0,Accenture,,4.0,Good Company,DevOps Lead,Singapore,Lot of good projects to work. Can work on all latest and trending technologies.,None to mention from my experience.
0,Accenture,,3.0,Good experience,Quality Analyst,Singapore,Employees can learn a lot of things and company cares for employee's welfare.,Enumeration package is very low compare to the market
0,Accenture,,5.0,Software Engineer,Software Engineer,Singapore,- a lot of learning opportunity,- sometimes work can be daunting
0,Accenture,,5.0,Great Place to learn and work,Senior Software Engineer,Singapore,Great working culture . Team is very supportive. lots of learning opportunities for junior analysts,-- - - - -
0,Accenture,,4.0,Flexible working,Front End Developer,Singapore,Admin and HR is very helpful during onboarding on covid period,So far there have nothing special to share.
0,Accenture,,5.0,Good,Software Developer,Singapore,Process followed is good and meet industry standards,Depends on the project you end up
0,Accenture,,3.0,Burn out Culture,Applications Development Senior Analyst,Singapore,Much to learn Colleagues are from diverse backgrounds Pay is inadequate for amount of working hours,Extremely demanding Deadlines Much overtime and working on weekends Uncompensated time off
0,Accenture,,5.0,"Good benefits, friendly culture. Reasonable deadlines",Software Engineering Senior Analyst,Singapore,"Flexible hours, task driven work. Depends largely on your team though.",Hours can be long if you don't manage time well.
0,Accenture,,5.0,NA,Quality Analyst,Singapore,Project Management. System Integration. System Implementation. Training. Post go-live Support.,More dynamic frameworks needed Core technology expertise.
0,Accenture,,2.0,"Hire thousands, Fire thousands",Applications Developer,Singapore,Good learning opportunities Diversity Good staff benefits,"Disorganized Company doesn't reflect its values, though it claimed so. Filled with FTs who has differing opinions and scared lose mentality Ambiguous hiring criteria for successful candidates Discrimination against disability Exposure to opportunities and growth depends on project"
0,Accenture,,5.0,Good place to stay,Software Engineer,Singapore,"nice and helpful people, package is good.",Might need to OT sometimes but depends from person to person.
0,Accenture,,4.0,Good company,Software Engineer,Singapore,Good company Good company Good company,Na Na Na Na Na Na
0,Accenture,,4.0,Nice office,Software Engineer,Singapore,Good environment for fresh grads,"Large organization, feels lost sometime"
0,Accenture,,3.0,Good company,Applications Developer,Singapore,Cheerful environment even in a stressful situation.,overtime most of the time haha
0,Accenture,,1.0,"Pathetic work culture,worst management",Senior Applications Developer,Singapore,Easy interview and selection process,- First company to introduce 2 month notice period in Singapore to exploit their employees. - Management cares about their billing with the client more than anything even if it means long hours and no work-life balance for the employees. - Waste a lot of time doing presentation slides for internal meetings. - Management is completely employee unfriendly.
0,Accenture,,5.0,Good place if you want to gain more IT project-related experience,Business and Integration Architecture Senior Analyst,Singapore,"- Fast Paced - A lot of opportunities to learn new tech - Colleagues are very nice to work with, and generally very helpful","- Learning curve is very steep - Not much opportunities if you choose to specialize in a certain Tech Stack - Long working hours, and no incentives provided by the company if you work overtime"
0,Accenture,,3.0,So much internal politics,Senior Engineer,Singapore,Good work location and view,so much of internal politics
0,Accenture,,5.0,SAP HR Consultant,Software Engineer Associate,Singapore,Everyone are nice and willing to help one another.,For me there are downsides to provide
0,Accenture,,1.0,Worst work-life balancing company,Java Software Developer,Singapore,"depend on the project you works on, you may get lucky","The company never thinks about the employees, most probably you have to work in a most unplanned and stressful environment."
0,Accenture,,5.0,Great place to learn,Systems Integration Manager,Singapore,Working with the best in industry,Can be demanding and competitive
0,Accenture,,4.0,Great company for those who aims for career growth,Software Engineering Team Lead,Singapore,- work with team across the globe - training opportunities - great career growth,- can be extremely stressful sometimes. Probably depends on project.
0,Accenture,,4.0,"Good place to start off a career, bad place if u want work life balance",Software Engineer,Singapore,- Dedicated and friendly young people - Managers are encouraging and willing to teach - Great exposure - different roles and industry for projects - Great corporate culture,"- Crazy working hours - Promotions sometimes is dependant on the months at level, in which affecting the actual promotion for the people who really put in effort. - For the amount of hours u put in, around 60 hrs per week - the amount of pay that you are getting is nuts."
0,Accenture,,2.0,All Pain without Gain,Software Engineer,Singapore,"Once hired, you get to attend a lot of good corporate parties in fancy hotels.As long as we do our job well , we do not have to worry about losing it.","Worked for a client whom I directly reported to and the client submitted great reviews about me. I had no Accenture side manager who had any idea of the kind of technical work that I did for the client. When it was time for my promotion cycle, I had to go on maternity leave , and I got to know later that due to some internal politics they gave preference to some other candidates whose rating was lower than mine under the assumption that I may decide to extend my maternity leave and may not come back after its completion.Also they completely ignored the positive reviews provided by the client and I had to call them up on a weekend to remind them to put the positive feedback in my appraisal as they were unaware of the work I had done as they have never been to my client workplace."
0,Accenture,,3.0,Decent but can be better,Senior S/W Engineer,Singapore,"- You tend to feel challenged at work. - If you are good performer, you tend to be given more opportunity to do more and learn more to the point that it way exceed your pay grade. - People are nice and fun here.",- Profit driven mentality leadership that willing to compromise quality to get this done. - Lack of mentorship. People with many years of experience unwilling to coach and want fresh grad to run the show - Compensation package is not as attractive as other firm. - Work life balance is subjective on the state of the project which frequently isnt balanced. - 15 days leave only? Come on
0,Accenture,,3.0,Depends on luck,Software Engineering Senior Analyst,Singapore,Great exposure for new joiner and fresh graduate as he will be exposed to the latest technology and methodology. Everyone has lots of opportunity to learn even though he might not have work-life balance.,"Performance appraisal is based on luck. At the end of the financial year, each will be graded through a banding system whereby your reviewer and counsellor will present your performance at a banding meeting. In my opinion, the grading system is pretty much based on the project revenue and how well your reviewer/supervisor fight for you in the banding meeting as you are graded against peers from other projects also. So, it pretty much depends on luck."
0,Accenture,,2.0,Unless you want to learn so many things in a short period of time...,Software Engineer,Singapore,"1. a lot of work. A LOT. 2. good place to start if you are a fresh graduate 3. good place to start if you don't have any technical background but want to pick up technical skills. 4. Good benefits (medical benefits, professional magazines subscription, dental allowance etc.)",1. a lot of work. 2. no work life balance 3. high expectations 4. terrible clients (this depends on the project but my clients were so demanding) 5. terrible culture. They will contact you at any time when they need you. They will expect you to put work first before everything else.
0,Accenture,,2.0,Time demanding and unfullfilling work,Associate Software Engineer,Singapore,"Extensive benefits Accenture offers all full-time employee subsidised medical compansation up to 30% of their clinical visits, and subsidised dental consultant. Full-time employees are allowed to visit some tourist attractions for free. High degree of autonomy and job flexible Everyone in the team is given a clear role in the project. They have been held accountable for their own actions, and they are allowed to work on the way they felt right. The company is on more of a 'Result-only work environment', when you can work at your own pace and timing, as long as you met the deadline. The company allow you to enter the company at your own timing as long as it's not overboard. I have worked with developers who only came into work after lunch.","No sense of purpose There is no sense of purpose working in the company. One of the company motto is ' Client Value Creation'. From my understanding Client Value Creation is to advise the client on what is the best for them, and not blindly follow what the clients, and in the end, let the clients suffer with a lousy product. Unattainable goals More often, the project manager sets unrealistic deadline for almost every aspects of the project. At the first start of the project planning, the management has already planned 10 (+/- 1) hours of workload to be completed in a workday, which allowed them to complete the project on-time. With such unattainable goal-setting, employees had to often finding them working overtime daily. Unfair pay compensation More than often, more than half of the employees work overtime more than 40% of their regular working hours for extended period of more than two months annually. There is no overtime pay for all additional hour put in. In additional, the management is not at all appreciative of the employees' overtime effort, instead, the management sees it as a complusory free labour. When comparing the pay structure of the project, almost half of the employees are being paid below the market rate. Closed-minded management Whenever the management encountered problem, they will seek advice from the employees. However, the management will more than often not take the advice, and made their own decision. This make the feedback irrelevant, and slowly, the employee stop giving feedback, as they knew that their feedback will not be taken by the management."
0,Accenture,,4.0,Great place to start your career,Senior Software Engineer/Analyst,Singapore,1- Good learning opportunities in terms of soft skills and technical ones 2- Great peers from whom you can learn a lot 3- Open to letting employees explore new opportunities,"1- You need to ask to get what you want 2- Competitive environment 3- At least in my immediate circumstance, the experience was not meant for someone who would want to maximise their technical skills 4- The hours can be challenging"
0,Accenture,,4.0,Great place to work at,Senior Software Engineer,Singapore,"New things to learn every day, client facing experience, get to interact with multi functional teams. Great helpful people, open communication environment. Great skills based training are available for employees.","Work life balance can take a hit during months following up to a release, since you are expected to hit the road running, it can be daunting at first."
0,Accenture,,5.0,Great learning experience!,Software Engineer,Singapore,- Professional environment with capable people to learn from as the consultants put in a considerable amount of effort to make sure we get a meaningful experience - Pays relatively well - Excellent brand name,- Long work hours - Pay difference between a software engineer and consultant considering almost the same amount of work scope
0,Accenture,,4.0,"Decent place to start, but not recommended to stay long unless you are a high flyer",Software Engineer,Singapore,- Brand name - Good benefits - Lots of learning opportunities in a structured environment,"- Low salary for software engineering jobs in general, although comparable to other big consulting SIs - Learning opportunities tend to stagnate after a while unless you get to move between different projects, which is rare - Progression limited and highly dependent on relationship with assigned mentor"
0,Accenture,,2.0,Software Engineer,Software Engineer,Singapore,A lot of experience to be gained,"Low salary compared to any where else and other roles. Not appreciated - no recognition. OT is free. Management sees how much OT you do and not whether you are efficient. Fresh grads who joined as software engineers either passion for programming are killed after 1 year and become dead logs, leave the company or change role. Senior management doesn't listen to people below."
0,Accenture,,4.0,Software Engineering Intern Review,Software Engineer Intern,Singapore,"Pretty Relaxed internship even though I got into a tough projects. Since, they took in many interns, my work was pretty relaxed and I finished everything in 10 weeks in a 12 week internship. Learnt VBA and SDLC processes and real life environment in software engieering",Not the most challenging environment. Could have more intern engagement.
0,Accenture,,4.0,Sell your life,Software Engineer,Singapore,"Lots of leaning opportunity with good starting pay and good benefits. Working with great people, with processes in place are to help reporting and analyzing easier.",Working hours is long throughout the year. Weekend work are needed also. Often have to give up time with family and friends to fulfill business needs.
0,Accenture,,4.0,"Reputable Company, but be prepared to work long hours",Software Developer,Singapore,"Good reputation, career stepping stone Work hard, Play hard culture Employee Share Options",Can lack work life balance Not very competitive salary increments / bonuses
0,Accenture,,3.0,Steep Learning Curve for People who like Challenges,Software Engineer,Singapore,Working in Accenture allows you to constantly gain new experience and clear career path,No payment for overtime works. Your satisfaction purely depends on what project you are working in and the management of that project.
0,Accenture,,3.0,Great culture and working environment but SE are lowball,Software Engineer Analyst,Singapore,"Culture, people and free pantry is always good(project)","SE base salary is low in comparison to other roles for H&PS. It feels like they do not see the value in SE and do not know the crucial role it plays in a project. If you're offered an SE position, rethink about joining."
0,Accenture,,3.0,effed up company,Solutions Architect,Singapore,-none really beyond the $400 allowance -a few good colleagues,"No sense of project continuity, huge churn. I got laid off with one week's notice albeit with 6 months' severance but still, finding a job in this economy is tough"
0,Accenture,,4.0,Low compensation,Senior Software Engineer,Singapore,"for fresh graduates, it is a good company to join as there will be many thing to learn given the fast pace.",bonus is low and everyone get almost similar. increment is really little as well and the pay in overall is not competitive enough if compared to the market.
0,Accenture,,3.0,have been in this company for 2 years,Associate Software Engineer,Singapore,"good reputation, when you leave from this company you can easily find the next one","long working hours, boring projects. sometime don get chance to learn a lot"
0,Accenture,,4.0,Good Company,Software Engineering Senior Analyst,Singapore,"good working environment, good people, good career opportunities","significant workload, long working hours, hard to get the work-life balance"
0,Accenture,,1.0,software engineer,Software Engineer,Singapore,- Good brand name - Able to win worthy projects despite economic downturn - Reward and promote those who work hard - Excellent prospect and compensation for those in consulting workforce,"- 'Great' disparity between consulting workforce and other workforces. If you are in other workforce, you get paid much lower, ordered around by consulting people even though you have the same qualifications. - Dont join unless you are offered a position in the consulting workforce."
0,Accenture,,2.0,"Stable company, toxic culture",Mobile Engineer,Singapore,"Stable company. Great compensation and benefits including health card, gym, LoA.","You don't have any choice whether you want to learn a certain language though. Politics are rampant here, sometimes affects a person's rating based on how close you are with your boss"
0,Accenture,,3.0,Good place to learn and earn,Change and Release Manager,Singapore,"Good place to Learn and contribute, very open culture (easy reach to senior management)",Bonus payment is not as good. Around 1 month yearly bonus approx. Not a good place for work life balance.
0,Accenture,,5.0,Good,Software Developer II,Singapore,"Expertise in coding, scripting, developing, testing, deploying for application creation and identifying issues and bugs, and devising creative solutions to mitigate and address issues",Demonstrated excellent communication/problem solving/analytical skills while working in cross-functional team environments and with clients from various backgrounds
0,Accenture,,3.0,Good place to work but not enough,Applications Development Senior Analyst,Singapore,"many projects can choose, work in different environments base on client site. Free trainings and regular department events.","Pay not that good, have to work as a `vendor` in client place. Management model not flexible."
0,Accenture,,5.0,Software Engineering Intern,Software Engineering Intern,Singapore,- Freedom to discuss ideas with senior colleagues and supervisors - Interns are motivated to learn new technologies on their own - Able to get support from team members whenever you face difficulties,- Long working hours
0,Accenture,,3.0,Senior Software Engineer,Senior Software Engineer,Singapore,Many things to learn. Good for freshers.,Below market average when comes to Salary.
0,Accenture,,5.0,Great career starter,Software Engineering Senior Analyst,Singapore,"Supportive and helpful colleagues, challenging but feasible work","Long hours, work on Saturdays, some teams are more well-managed than others"
0,Accenture,,3.0,good to start with. not for long term,Cloud Manager,Singapore,good to start with in a consulting firm before you decide what you want to do,leave it when you know what you want to. cannot stay focus
0,Accenture,,2.0,Profit focused,Solutions Architect,Singapore,Training between projects. Lots of technology to learn.,Your performance is determined by sales or profit brought to company which leads to underhand methods used to capture sales. Many are overworked to deliver overpromised projects.
0,Accenture,,3.0,good place to learn,Senior Software Engineer,Singapore,you can gain a lot of experience by exposing to various projects,you may not always get the chance to do what you want to do even you have related experience
0,Accenture,,3.0,Solution Architect Review,Solution Architect,Singapore,Able to experience sales approached and steps of global consulting firm at an early stage of career.,Not able to concentrate on a dedicated solution because of multiple deals assigned to you.
0,Accenture,,5.0,Consulting World,Solutions Architect,Singapore,Learn alot and only deal with big customer. Has alot of training opportunities,"If you are on bench, you need to do many work and might not be appreciated."
0,Accenture,,4.0,-,Software Engineer,Singapore,"Accenture is overall a good company to work with"" The policies of the company complements to employee satisfaction.",Work life balance; benefit package not as competitive as with other company
0,Accenture,,5.0,Good for career start,Technical Architect,Singapore,Lots of opportunities for trying different technologies and industries,Hard to move up from mid level position
0,Accenture,,3.0,Average,Software Engineering Senior Analyst,Singapore,If you are lucky enough you will get opportunity to work on some great project which allowed you to learn cool and new things.,Company valued presentation skill then technical skills.
0,Accenture,,3.0,Good learning experience,Software Engineering Team Lead,Singapore,"Good people, challenging and quality work delivered",Compensation and Work-life balance is not so good
0,Accenture,,3.0,No worklife balance,Software Engineer,Singapore,Nice pantry and forced to write this review,"no workload balance, very few people doing the ground work yet many 'leads'"
0,Accenture,,4.0,Good culture and meaningful impact in the work that is done,Software Engineer,Singapore,Work that is being done has high and wide impact given the resources available,Limited growth in technical knowledge
0,Accenture,,5.0,Good Learning and Opportunities,Digital Integration Manager,Singapore,"Good if you are self starter, proactive, many projects","Many projects lack of ppl, and client expectations is high"
0,Accenture,,3.0,"Good people, bad management",Solutions Architect,Singapore,Lovely and easygoing colleagues Good benefits,"Managements fails to secure contracts, and fires engineering team instead of taking the blame"
0,Accenture,,4.0,Management not helpful,Senior Software Engineer,Singapore,"Colleagues are good and friendly, able to learn new skills","No work life balance, management don't usually speak out for their co workers"
0,Accenture,,5.0,Nice Company to start and grow with,Data Engineering Consultant,Singapore,- Nice Growth - Mixed Culture & people - Good Leadership,"- Sometimes Too Much work , Depends on Project"
0,Accenture,,5.0,Accenture is a good company to start with,Quality Assurance,Singapore,"Employee benefits like transportation, health benefits, safety etc.",there is No Onshore opportunities for the enmployees
0,Accenture,,3.0,Software Engineer,Software Engineer,Singapore,Good stepping stone and a lot of friendly co-workers.,"Slow promotion and long working hours, lacks work/life balance."
