,company_name,date_posted,rating,review_title,job_position,job_location,pro_review,con_review
0,Google,,5.0,Google is not the Google as before,Software Engineer,Singapore,"From serval perspectives, Google is still the top place compared to other tech companies, such as talent colleagues, infrastructure & tools.","Unlike serval years ago, there are budget cuts, layoffs, and promotion becomes harder which makes Google not a place for retirement."
0,Google,,4.0,"Smart respectful engineers, good culture, lots of different systems",Senior Software Engineer,Singapore,The culture is awesome - people really care for each other,"lots of different systems, many legacy you end up spending more time understanding existing systems - many of which do similar things, many are legacy or just plain old mostly waterfall planning"
0,Google,,5.0,Very good,AI Engineer,Singapore,"Very good, work life balance",No cons that I can think of
0,Google,,4.0,OK,Software Engineer,Singapore,Good perks and work life balance,Too much politics and not the best place for early career growth
0,Google,,5.0,happy years in Google,Senior Java Developer,Singapore,"relax feel good,the atmosphere is amazing",colleages always take too long leaves for vocations
0,Google,,5.0,Superb company to be in,Software Engineer,Singapore,All pros no cons. Benefit is great.,Super. No con. Awesome environment
0,Google,,5.0,Lots of benefits,Software Engineer,Singapore,A lot of perks for employess,"Depends on location, employees can feel less appreciated compared to US counterpart."
0,Google,,5.0,Best workplace,Operating Engineer,Singapore,Work life balance and flexibility,Lack of career progression and learning opportunities
0,Google,,4.0,Culture getting worse,Software Engineer,Singapore,Daily free food with loads of options.,Different teams having vastly different workload.
0,Google,,5.0,decent,Junior Developer,Singapore,good pay good benefits good staffs,far to travel from suburbs
0,Google,,3.0,Laid Off,Software Development Engineer (SDE),Singapore,Everything was good before 2022.,Laid off immediately without any consideration.
0,Google,,5.0,Great Company,Software Engineer,Singapore,"Free snacks and drink in office, friendly workers and tons of benefits!",no cons here at Google
0,Google,,5.0,Nice WLB,Software Engineer,Singapore,"Good WLB, nice benefits. Lots of learning opportunities.","Slow promotion, low ball package."
0,Google,,5.0,Senior ML Engineer,Senior ML Engineer,Singapore,Good work experience Free Lunch,"None so much, have so much opportunities"
0,Google,,3.0,software engineer,Software Engineer,Singapore,Google is most frendly. there attitude is multi talented.,i have no comment this purpose.
0,Google,,5.0,Excellent Experience,Software Engineer,Singapore,"Great work life balance, mentoring and benefits","No cons at all, other than that it makes you fat"
0,Google,,3.0,Good,Software Engineer,Marina South,"Good salary, free lunch and snacks",Nothing bad about it at google
0,Google,,5.0,Nil,Junior Software Engineer,Singapore,Good work life balance and salary,Hard to progress for career
0,Google,,5.0,Great place to build a long and stable career,Software Engineer,Singapore,"Big company, lots of opportunity to try new things. Leaders listen to employees. Long time Googlers care about the culture, and ensure the company stays true to its values.","Big company, a lot of the work is not glamorous anymore. We need to keep things running for billions of users. We need to stay at the cutting edge of privacy. So less opportunity to build brand new things."
0,Google,,5.0,Great perks and culture!,Software Engineer,Singapore,"- Fun and challenging projects to work on. - Good culture within and across teams. - Best-in-class perks, including paternal leave.","The company has gone fully remote since the start of the pandemic, but has not committed to a fully remote work status. Employees are expected to return to office when the pandemic subsides."
0,Google,,5.0,"Challenging, yet rewarding",AI/ML Engineer,Singapore,"Working at Google is really challenging. Every day, you are solving some of the most interesting problems in a highly efficient and optimized way. If you want to up your game, Google is the right place to be.","One has to be careful with internally switching teams. Make sure that the new team will be a good fit for you. Otherwise, it will not be very productive both for the team and for yourself."
0,Google,,5.0,culture review,Software Engineer,Singapore,its good to be on google,hard to say any cons
0,Google,,4.0,Good workplace,Engineer,Singapore,"Nice environment, good colleagues and good salary",Nothing in particular. Overall good experience
0,Google,,5.0,Very good,Senior Software Engineer,Singapore,innovative innovative innovative innovative innovative,flexible flexible flexible flexible flexible
0,Google,,5.0,not bad,Software Engineer,Singapore,"not bad, feel work life balance","not bad, far from home"
0,Google,,5.0,Software Engineer,Software Engineer,Singapore,"Flat Culture, Great Benefit and Facility","Overworked, Extreme Competitive, OT, Slow Deployment"
0,Google,,4.0,SWE,Software Engineer (Swe II),Singapore,Wok Life Balance and good food,low ball than other company
0,Google,,5.0,"Interesting work, good work life balance",Software Engineer II,Singapore,"Good working hours, lots of other benefits (health care, education, etc.)",As far as I know no problem.
0,Google,,5.0,Best company,Staff Engineer,Singapore,High pay good wbl and benefits,"Hard to get in, no diversity"
0,Google,,5.0,Good,Software Engineer,Singapore,"All good, everything good, like it","Current don’t have, maybe tell next time"
0,Google,,2.0,good stuff,Senior Software Engineer,Singapore,great company to work for,terrible ceo. do not approve
0,Google,,5.0,Engineering support,Engineer,"Jurong West New Town,",Good culture and constructive workplace,Slow pace and less growth
0,Google,,5.0,Senior Software Engineer,Senior Software Engineer,Singapore,Self Motivation Team Player. who always think out of the box.,nothing special which i can identify
0,Google,,5.0,yes,Junior Software Engineer,Singapore,great company smart people great pay,nothing much to be honest
0,Google,,5.0,Proud to be Googlers,Software Engineer,Singapore,Owsm company Everyone are cooperative,"No cons in Google ,best job"
0,Google,,5.0,Awesome company!,Software Engineer,Singapore,Growing rapidly despite its mega size,Hiring process is too slow and painful for candidates
0,Google,,4.0,Looking for jobs to gain more success,Senior Software Engineer,Singapore,"The working environment at Google is very much conducive, colleagues are really helpful and attend you when you are in need.",Well it can get stressful sometimes.
0,Google,,5.0,Great mentorship,Software Product Sprint,Singapore,- Get to work on a group project under great mentorship of a google engineer - Weekly soft skills and technical skills training sessions,Nothing much. It is a very well organized program
0,Google,,4.0,L3 Experience,Software Engineer,Singapore,Great benefit. They will cover most of people's general problems.,Too much politics if you have bad upper-management
0,Google,,5.0,Software Engineer,Software Engineering,Singapore,Nice people to work with,Easy to replace as the team is full of super stars
0,Google,,4.0,Good pay and good culture,Technical Lead,Singapore,Big tech name and you know it is good,OT culture and tight deadlines to be mets
0,Google,,5.0,Nice Place to work,Senior Software Engineer,Singapore,Awesome working place to work,sleepless nights. countless meetings to attend
0,Google,,5.0,Mi zjzfnxmznvzmgsjgjfgj,Senior Software Engineer,Singapore,"Good working culture, excellent food options good holidays",No cons all the things are perfect and blessings
0,Google,,5.0,Great inclusive culture,Software Engineer,Singapore,Work on meaningful projects with top talents,Mostly the same as a standard software engineer's woes
0,Google,,5.0,Working at Google is an unique oppotunity,Software Developer,Singapore,Working at Google is a unique opportunity,it is really stressful sometimes
0,Google,,5.0,Sr Software Eng.,Senior Software Eng,Singapore,Excellent Work env and cult.,Work hrs and vacation alloc.
0,Google,,5.0,Good place to start career.,Google Engineering Practicum,Singapore,Easy Going and plenty of employee benefits.,Sometimes lack structure and timing.
0,Google,,5.0,Great place to work,Software Engineer,Singapore,Great place to work Great place to work,nothing to declare here etc
0,Google,,5.0,good place to work at,Software Engineer,Singapore,freedom to initiate projects fast processes,no cons so far that I see
0,Google,,5.0,"Great working culture, pay is great",Software Engineer,Singapore,"Flexible working arrangements, relaxed atmosphere",I can't find a flaw.
0,Google,,5.0,good company,Computer Programmer,Singapore,many benefits and compensations. lively work environment,no cons as company spirit is good
0,Google,,4.0,Maintain DC Business,Engineer,Singapore,"Good enviroment, flexible working time","A lot of OT, not enough man power"
0,Google,,5.0,Good place to work,Software Engineer,Singapore,Great atmosphere Nice place Good tech High salary,More challange Hard to hired No fulltime remote
0,Google,,5.0,Great,Software Development Engineer,Singapore,Love it and the dining hall is pretty great.,Pay is not so good.
0,Google,,5.0,best,Engineering Executive -Manager,Singapore,very conducice environent to work in,very high standards...hard to compete with sundar pichai
0,Google,,5.0,Good environment,Engineer,Singapore,Lot of employee welfare for everyone to use,Not that i think of
0,Google,,4.0,Engineering,Software Engineer,Singapore,Salaries high and the environment is very nice,I think there are no cons
0,Google,,5.0,Good company,Software Development Engineer,Singapore,Nice office and colleague Good work life balance,there is no cons s
0,Google,,3.0,Very great!,Software Engineer,Singapore,"Talented people, great work life balance",Things could be a little slow
0,Google,,5.0,Nice environment,Engineer,Singapore,good learning to start here,nothing bad but more flexibility
0,Google,,4.0,Best to work,Software Developer,Singapore,flexible working good working environment the perks,Potentially long durations between promotions.
0,Google,,5.0,Good wlb,Software Engineer,Singapore,Good wlb and good compensation,Less growth and interesting work
0,Google,,4.0,Software engineer,Software Engineer,Singapore,- Awesome work life balance.,- Less variety of work.
0,Google,,4.0,Good,Software Engineer,Singapore,"Good and Fun, very interesting","No Cons, eat food every day"
0,Google,,1.0,Check one time,Software Engineer,Singapore,Salary is very good and the only good reason,"Long working hours, like very long"
0,MSD,,5.0,Good place for work life balance,Senior Software Engineer,Singapore,1. Company has good leadership and vision. 2. Very good work life balance. 3. Leaders always encourage us to decline meetings after work hours and take breaks. Nobody disturbs you when you are on holiday. 4. People that you work with are likely to be experts in their fields. 5. The products are meaningful and give you a sense of purpose. Products/software you build is not just going to line a rich man’s pocket but is actually useful for humanity.,"1. Salary is on the lower side compared to tech companies, but you also won’t get fired like tech companies."
0,MSD,,3.0,Current MSD employee,Quality Associate,"Tuas,",High workload and shortage of manpower,Great employee benefits for permanent staff
0,MSD,,3.0,Working at MSD,Engineer,"Tuas,",Teamwork culture is very strong.,There is inadequate work life balance.
0,MSD,,4.0,Overall a great company,Software Engineer,Singapore,"- Great work-life balance - Most teams have good culture - Decent benefits (medical, flexible, bonus)",- Slow pace - Salary for IT roles not very competitive
0,MSD,,4.0,Senior Automation Engineer,Senior Automation Engineer,Singapore,Good to learn and explore new technologies.,Too much work load pressure
0,MSD,,4.0,Experience with MSD,Quality Associate,Singapore,Good place to learn and grow,"Low pay, often long working hours"
0,MSD,,4.0,Internship Review,Cloud Engineer Intern,Singapore,"Amazing office culture, supportive colleagues.",Smaller IT team in Singapore
0,MSD,,3.0,Decent pay but limited progression,Senior Engineer,"Tuas,","Good rewards/recognition system, good management, open feedback culture","Slow progression, limited transport arrangements, too much work but not enough manpower"
0,MSD,,5.0,Great place to work,Data Engineer,Singapore,Inclusive and welcoming work place Recognition and reward programs Good bonus Growth opportunities,"US based company, so need to extend evenings to connect with US customers Less opportunities in SG compared to US, Europe region"
0,MSD,,4.0,Good MNC,Quality Control,Singapore River,- Good MNC package - Reputable organization,Non I can think of
0,MSD,,4.0,Flexible work arrangement,Quality Assurance,Singapore,"Good work life balance, hybrid work arrangement.","Company transport is really bad. Very few locations in the morning, only drop off at tuas during evening."
0,MSD,,4.0,Good benefit,Automation Engineer,"Tuas,",Multiple medical benefit Good peer incentives,Long working hours required Standby duty
0,MSD,,4.0,Good,Engineer,"Tuas,","interesting work, great people and great managers",stakeholder management can be difficult
0,MSD,,5.0,MSD,AI Specialist,Singapore,Good benefits package Nice culture Forward-thinking Professional,Too much work leads to stress.
0,MSD,,3.0,Life at MSD,Engineer,Singapore,Company is stable. Would get piece of mind.,Some work even easy task require with various departement or team in different part of the world which quite challenging to collaborate resulting in slow progress.
0,MSD,,4.0,Challenging role ; Wonderful Work Culture ; An approachable Leadership team!,Senior Automation Engineer,Singapore,"A fantastic organization, amazing work culture, a good team and very competitive-supportive functioal teams. One can approach any personnel in the organisation irrespective of their position to get your doubts clarified! Senior Management listens to you very well and looks to take an action, which I think motivates anyone!","Be prepared for Long working hours especially in any supporting roles. Poor Work-Life balance, but the management has been taking action to better it. Compensation could be a better for the amount of work being done."
0,MSD,,5.0,Not good for fresh graudate to learn technique skill,Automation Engineer,"Jurong West New Town,","Good management, exposed to many different brand knowledge",don't have time to focus on one thing. have to do multiple tasks parallelly. Sometimes need to complete the task in Weekend.
0,MSD,,4.0,Good place for industrial automation engineer,Automation Engineer,Singapore,got senior manager position for industrial automation,workload can be over whelming
0,MSD,,4.0,Salary,Quality Analyst,"Tuas,",Team work and good communication is maintained in this company.,Paid the same but sometimes twice the work.
0,MSD,,3.0,Work Life Balance,Senior Software Engineer,Singapore,Work life balance. Family first policy. Great culture.,"Night calls, off hour calls. Paid the same but sometimes twice the work. Low compensation compare to IT industry."
0,MSD,,4.0,Working Environment in MSD,PTO Engineer,"Tuas,",Working culture and environment is relatively nice.,The cafeteria food is not what as you expected.
0,MSD,,4.0,Good place to work,Engineer,Singapore,Talented and dedicated co-workers and superiors,Salary not competitive compared to other industry
0,MSD,,1.0,Bad work Life balance,Pharmaceutical Technical Operations Engineer,Singapore,Exposure to big projects in junior role,Inhumane hours and unpaid Overtime No chance to clear leave
0,MSD,,5.0,Great Employer,Software Engineer,Singapore,Great work place to learn and evolve Good opportunities Employee benefits Flexibility Diverse culture,No remote working from home country
0,MSD,,5.0,Engineer Specialist,Engineer Specialist,"Queenstown Estate,",Nice ambience and friendly people.,Workload is very high. Things get pushed to you even its not under your scope
0,MSD,,3.0,Still new.,Engineer,Singapore,"Good environment. Lots of friendly colleagues to talk to, transport provided to jurong east, Boon Lay and choa Chu Kang.",Learning the processes can be hard for new comers. Please bear in mind that not everybody is required to learn about the processes
0,MSD,,5.0,Good culture,Software Engineer,Singapore,Helpful colleague Good Culture Established enterprise system to mitigate risk,Complicated Bussiness Process Slow moving in many areas
0,MSD,,5.0,Excellent place to work with great work life balance and staff benefits,Senior Mobile Applications Developer,Singapore,Healthcare Benefits Work-life balance Work which impact lives,Too many meetings Many compliance and process-related issues Hierarchical
0,MSD,,5.0,Good Company for Freshers,Automation Engineer,Singapore,"Good Team, Friendly and Professional Employees",Hectic work to meet deadlines.
0,MSD,,5.0,Good to work,Engineer,Singapore,Everyone is willing to share the knowledge,"Workload is quite high, often have problem"
0,MSD,,4.0,Good salary No life,Senior Automation Engineer,Singapore,"Good salary, good bonus benefits",No work life balance
0,MSD,,4.0,Good Job Advancement,Quality Assurance,Singapore,Big Organisation Open concept Systematic People Management,Complexity Adapt to changes Least work life balance
0,MSD,,4.0,Review of MSD,Equipment Engineer,Singapore,"Good place to work, good coulture",Lot of work will feel more pressure
0,MSD,,3.0,Engineer,Engineer,Singapore,"Nice culture, friendly people & nice work-life balance","Not complete training process, low salary"
0,MSD,,1.0,Looks great on the outside only,QA Specialist,"Tuas,",stable MNC with good reputable.,"No training development, HR benefits are lousy."
0,Amazon,,5.0,Good company,Software Develoeper,Singapore,Good Environment Good Place to Learn,No No No No No
0,Amazon,,4.0,Review up for reivew,Engineer,Singapore,nice job for entry level position,long hour job. low pay
0,Amazon,,2.0,Low pay of company,Data Engineer,Singapore,More chances to learn the new tech,Always need to overtime and communication cost is high
0,Amazon,,3.0,Great company & Perks,Senior Software Engineer,Singapore,- Flexible working hours - Can still work from home for some of the week - Great team,- To much middle management - Difficult to get anything approved in quick time
0,Amazon,,3.0,Excellent,Software Engineer,Singapore,"Great culture (no blame culture, great mentorship, opportunities for growth) Valuable mission Good wlb",pantry wasn't big enough for me
0,Amazon,,5.0,Lots to learn and always on go,Senior Solution Architect,Singapore,Fun to learn and lots to learn. Love the customer obsession and wanting to do the right by the customer,Lots of expectations to fulfil
0,Amazon,,5.0,AWSome Company to work for!,Senior Solutions Architect,Singapore,* Go-getter culture permeates the entire company * Extremely customer focused - you will learn to put the customer at the center of all our thought * Most leaders live by the Amazon Leadership Principles most of the time * Fun work culture,* Work can get to you if you do not prioritize and filter work * While technical eminence is part of your KPI - it usually comes at the cost of a lot of after work hour effort * Direct culture - be prepared to hear blunt feedback - but it is not meant in a negative way
0,Amazon,,5.0,New Joiner Review,Senior Cloud Architect,Singapore,"The company lives and breathes by the Leadership Principles, they are not for show unlike other companies, and the culture is excellent. The focus on onboarding is the best I've seen in my 10+ years of working. Hierarchy is flat, the colleagues are excellent, there is a high level of psychological safety in terms of speaking up and making honest (non-deliberate) mistakes. All of their working principles are backed by scientific research you have probably read in articles (eg. Harvard Business Review, etc), but almost never followed in your current company ever - except Amazon. Technical wise, you working for the world's best Cloud Provider and have a ton of opportunities to learn.","The culture is not for everyone. You have to be very disciplined, a self-starter, and manage your own time and career. In short, you must have a high degree of ownership. This is not a con if you have the right mindset and making very deliberate choices on what you want to focus on (job, experience, family, etc.) Looking at what others have written negatively, especially about work-life balance, they are more of a bad fit rather than a con of working at Amazon. There are many avenues to seek help when you feel overwhelmed, but you have to own the decision."
0,Amazon,,5.0,"Flat organizational structure, amazing company culture",Mechanical Engineer,Singapore,"great platform to get exposure to the the most advanced data center technology, various types of project","fast pace in working, customer-centric based on fast response of the Amazoniars."
0,Amazon,,5.0,"Fast Paced Environment, Great for Growth",AWS Cloud Architect,Singapore,"The environment is very fast paced, with fantastic learning opportunities since Day 1. Salary and compensation is good (RSUs etc), not to mention the strong brand name/prestige that comes from working at FAANG. You also get to work with highly intelligent people.","Work life balance leaves more to be desired, but that's due to being shorthanded in a high growth sector."
0,Amazon,,5.0,this is an anonymous post,Senior Cloud Architect,Singapore,this is an anonymous post for salary,there are no downs in working for amazon
0,Amazon,,4.0,You cannot go wrong being obsessed over the customer,Solutions Architect,Singapore,"The company puts customer first in everything. Giving the customer the greatest value is the obsession of its leaders. Always do what's best for the customer, preferring long term wins over short term gains. Invent and simplify for the customer's sake.",Too many independent teams making independent decisions can sometimes result in inconsistency. Being over focussed on the leader principles can become too inward looking.
0,Amazon,,4.0,Great Onboarding experience,Solutions Architect,Singapore,"I've only been here for less than 6 months, so main comments are regarding onboarding experience - Very helpful manager/mentor and team. Can't comment on other teams though. - Guided onboarding with clear tasks and activities to perform - Choice of laptops - WFH equipment compensation - Mobile/bill compensation -AWS exams compensation - Flexible working hours","- Be prepared for information overload during onboarding period - Even though it is encouraged to have a good WLB, it is difficult to keep up with the amount of things to do"
0,Amazon,,5.0,Good benefit,Solutions Architect,Singapore,"Great culture, great colleagues, decent office.",Sometimes really challenging customers to handle
0,Amazon,,5.0,AWS Singapore,Solutions Architect,Singapore,"Great place to work, a lot of learning opportunities been provided to grow and continuously development. People are willing to share and help each other all the time.","There are so many things to learn, but this is also an advantage if you enjoy the continuous self-improvement"
0,Amazon,,5.0,The Leading Cloud Provider,Senior Specialist Solutions Architect,Singapore,Work with best minds in industry Understand the culture of innovation Best chance to learn about AWS Cloud,Nothing I can think of
0,Amazon,,5.0,One of the best company I have worked with,Field Mechanical Engineer,Singapore,Lots of learning and opportunity to innovate.,Lack of processes which makes it difficult for new hires.
0,Amazon,,3.0,Consulting,Software Engineer,Singapore,Flat Management structure and family type.,You are a full-stack software developer.
0,Amazon,,5.0,"Can be busy, but work is very focused",Solution Architect,Singapore,Plenty of learning and upskilling opportunities. Get all the AWS certifications if you like. Colleagues are generally helpful and friendly and you can get mentorships. Internal transfers can be requested for. Fully work from home during COVID.,"Work can be rather busy at times, especially during the first 3 months of onboarding. Knowing how to prioritize and guard your time is important."
0,Amazon,,3.0,stressful environment,Senior Solution Architect,Singapore,work from home flexibility base salary,"politic , promotion process, work life balance"
0,Amazon,,5.0,AWS Review,Solutions Architect,Singapore,"Work with smart people, plenty of opportunities to learn new technologies, skills and make an impact.",None experienced so far in my career.
